{"description": "baseline: sims=100 c_puct=1.5 leaf=16 T=1 lambda=0 solver=0 merge=off", "var": {}, "status": "keep", "result": {"search_optimal": 0.8233, "root_q_sign": 0.975, "searched_positions": 600, "positions": 600, "sec_per_move": 0.0736, "elapsed_seconds": 44, "peak_vram_mb": 0, "checkpoint": "/home/user/autoboxes/experiments/2026-10-08_14-42-boxes-3x3-loop/checkpoints/3x3-cpu/iter5.pt", "var": {"num_simulations": 100, "c_puct": 1.5, "leaf_batch_size": 16, "policy_temperature": 1.0, "margin_utility_lambda": 0.0, "margin_utility_k": 6.0, "solver_max_undrawn": 0, "solver_node_budget": 20000, "merge_equivalent": false}}, "seconds": 62}
{"description": "c_puct=1.0", "var": {"c_puct": 1.0}, "status": "discard", "result": {"search_optimal": 0.8183, "root_q_sign": 0.9733, "searched_positions": 600, "positions": 600, "sec_per_move": 0.0719, "elapsed_seconds": 43, "peak_vram_mb": 0, "checkpoint": "/home/user/autoboxes/experiments/2026-10-08_14-42-boxes-3x3-loop/checkpoints/3x3-cpu/iter5.pt", "var": {"num_simulations": 100, "c_puct": 1.0, "leaf_batch_size": 16, "policy_temperature": 1.0, "margin_utility_lambda": 0.0, "margin_utility_k": 6.0, "solver_max_undrawn": 0, "solver_node_budget": 20000, "merge_equivalent": false}}, "seconds": 61}
{"description": "c_puct=2.5", "var": {"c_puct": 2.5}, "status": "keep", "result": {"search_optimal": 0.8267, "root_q_sign": 0.975, "searched_positions": 600, "positions": 600, "sec_per_move": 0.0741, "elapsed_seconds": 44, "peak_vram_mb": 0, "checkpoint": "/home/user/autoboxes/experiments/2026-10-08_14-42-boxes-3x3-loop/checkpoints/3x3-cpu/iter5.pt", "var": {"num_simulations": 100, "c_puct": 2.5, "leaf_batch_size": 16, "policy_temperature": 1.0, "margin_utility_lambda": 0.0, "margin_utility_k": 6.0, "solver_max_undrawn": 0, "solver_node_budget": 20000, "merge_equivalent": false}}, "seconds": 62}
{"description": "c_puct=0.75", "var": {"c_puct": 0.75}, "status": "discard", "result": {"search_optimal": 0.82, "root_q_sign": 0.975, "searched_positions": 600, "positions": 600, "sec_per_move": 0.0716, "elapsed_seconds": 43, "peak_vram_mb": 0, "checkpoint": "/home/user/autoboxes/experiments/2026-10-08_14-42-boxes-3x3-loop/checkpoints/3x3-cpu/iter5.pt", "var": {"num_simulations": 100, "c_puct": 0.75, "leaf_batch_size": 16, "policy_temperature": 1.0, "margin_utility_lambda": 0.0, "margin_utility_k": 6.0, "solver_max_undrawn": 0, "solver_node_budget": 20000, "merge_equivalent": false}}, "seconds": 60}
{"description": "leaf_batch_size=8 (more sequential, less virtual loss)", "var": {"c_puct": 2.5, "leaf_batch_size": 8}, "status": "keep", "result": {"search_optimal": 0.8283, "root_q_sign": 0.9767, "searched_positions": 600, "positions": 600, "sec_per_move": 0.109, "elapsed_seconds": 65, "peak_vram_mb": 0, "checkpoint": "/home/user/autoboxes/experiments/2026-10-08_14-42-boxes-3x3-loop/checkpoints/3x3-cpu/iter5.pt", "var": {"num_simulations": 100, "c_puct": 2.5, "leaf_batch_size": 8, "policy_temperature": 1.0, "margin_utility_lambda": 0.0, "margin_utility_k": 6.0, "solver_max_undrawn": 0, "solver_node_budget": 20000, "merge_equivalent": false}}, "seconds": 83}
{"description": "leaf_batch_size=4", "var": {"c_puct": 2.5, "leaf_batch_size": 4}, "status": "keep", "result": {"search_optimal": 0.8333, "root_q_sign": 0.9867, "searched_positions": 600, "positions": 600, "sec_per_move": 0.1514, "elapsed_seconds": 91, "peak_vram_mb": 0, "checkpoint": "/home/user/autoboxes/experiments/2026-10-08_14-42-boxes-3x3-loop/checkpoints/3x3-cpu/iter5.pt", "var": {"num_simulations": 100, "c_puct": 2.5, "leaf_batch_size": 4, "policy_temperature": 1.0, "margin_utility_lambda": 0.0, "margin_utility_k": 6.0, "solver_max_undrawn": 0, "solver_node_budget": 20000, "merge_equivalent": false}}, "seconds": 109}
{"description": "leaf_batch_size=32", "var": {"c_puct": 2.5, "leaf_batch_size": 32}, "status": "discard", "result": {"search_optimal": 0.8, "root_q_sign": 0.955, "searched_positions": 600, "positions": 600, "sec_per_move": 0.0667, "elapsed_seconds": 40, "peak_vram_mb": 0, "checkpoint": "/home/user/autoboxes/experiments/2026-10-08_14-42-boxes-3x3-loop/checkpoints/3x3-cpu/iter5.pt", "var": {"num_simulations": 100, "c_puct": 2.5, "leaf_batch_size": 32, "policy_temperature": 1.0, "margin_utility_lambda": 0.0, "margin_utility_k": 6.0, "solver_max_undrawn": 0, "solver_node_budget": 20000, "merge_equivalent": false}}, "seconds": 58}
{"description": "policy_temperature=0.7 (sharper priors)", "var": {"c_puct": 2.5, "leaf_batch_size": 4, "policy_temperature": 0.7}, "status": "keep", "result": {"search_optimal": 0.8533, "root_q_sign": 0.9783, "searched_positions": 600, "positions": 600, "sec_per_move": 0.1507, "elapsed_seconds": 90, "peak_vram_mb": 0, "checkpoint": "/home/user/autoboxes/experiments/2026-10-08_14-42-boxes-3x3-loop/checkpoints/3x3-cpu/iter5.pt", "var": {"num_simulations": 100, "c_puct": 2.5, "leaf_batch_size": 4, "policy_temperature": 0.7, "margin_utility_lambda": 0.0, "margin_utility_k": 6.0, "solver_max_undrawn": 0, "solver_node_budget": 20000, "merge_equivalent": false}}, "seconds": 108}
{"description": "policy_temperature=1.5 (flatter priors)", "var": {"c_puct": 2.5, "leaf_batch_size": 4, "policy_temperature": 1.5}, "status": "discard", "result": {"search_optimal": 0.8383, "root_q_sign": 0.9817, "searched_positions": 600, "positions": 600, "sec_per_move": 0.1552, "elapsed_seconds": 93, "peak_vram_mb": 0, "checkpoint": "/home/user/autoboxes/experiments/2026-10-08_14-42-boxes-3x3-loop/checkpoints/3x3-cpu/iter5.pt", "var": {"num_simulations": 100, "c_puct": 2.5, "leaf_batch_size": 4, "policy_temperature": 1.5, "margin_utility_lambda": 0.0, "margin_utility_k": 6.0, "solver_max_undrawn": 0, "solver_node_budget": 20000, "merge_equivalent": false}}, "seconds": 111}
{"description": "margin_utility_lambda=0.25 (k=6), PLAN 6.4", "var": {"c_puct": 2.5, "leaf_batch_size": 4, "policy_temperature": 0.7, "margin_utility_lambda": 0.25}, "status": "keep", "result": {"search_optimal": 0.86, "root_q_sign": 0.9833, "searched_positions": 600, "positions": 600, "sec_per_move": 0.1467, "elapsed_seconds": 88, "peak_vram_mb": 0, "checkpoint": "/home/user/autoboxes/experiments/2026-10-08_14-42-boxes-3x3-loop/checkpoints/3x3-cpu/iter5.pt", "var": {"num_simulations": 100, "c_puct": 2.5, "leaf_batch_size": 4, "policy_temperature": 0.7, "margin_utility_lambda": 0.25, "margin_utility_k": 6.0, "solver_max_undrawn": 0, "solver_node_budget": 20000, "merge_equivalent": false}}, "seconds": 106}
{"description": "margin_utility_lambda=0.5 (k=6)", "var": {"c_puct": 2.5, "leaf_batch_size": 4, "policy_temperature": 0.7, "margin_utility_lambda": 0.5}, "status": "keep", "result": {"search_optimal": 0.8717, "root_q_sign": 0.985, "searched_positions": 600, "positions": 600, "sec_per_move": 0.1465, "elapsed_seconds": 88, "peak_vram_mb": 0, "checkpoint": "/home/user/autoboxes/experiments/2026-10-08_14-42-boxes-3x3-loop/checkpoints/3x3-cpu/iter5.pt", "var": {"num_simulations": 100, "c_puct": 2.5, "leaf_batch_size": 4, "policy_temperature": 0.7, "margin_utility_lambda": 0.5, "margin_utility_k": 6.0, "solver_max_undrawn": 0, "solver_node_budget": 20000, "merge_equivalent": false}}, "seconds": 106}
{"description": "margin_utility_lambda=0.25 k=3", "var": {"c_puct": 2.5, "leaf_batch_size": 4, "policy_temperature": 0.7, "margin_utility_lambda": 0.25, "margin_utility_k": 3.0}, "status": "discard", "result": {"search_optimal": 0.86, "root_q_sign": 0.985, "searched_positions": 600, "positions": 600, "sec_per_move": 0.1512, "elapsed_seconds": 91, "peak_vram_mb": 0, "checkpoint": "/home/user/autoboxes/experiments/2026-10-08_14-42-boxes-3x3-loop/checkpoints/3x3-cpu/iter5.pt", "var": {"num_simulations": 100, "c_puct": 2.5, "leaf_batch_size": 4, "policy_temperature": 0.7, "margin_utility_lambda": 0.25, "margin_utility_k": 3.0, "solver_max_undrawn": 0, "solver_node_budget": 20000, "merge_equivalent": false}}, "seconds": 109}
{"description": "merge_equivalent=True (one action per chain/loop)", "var": {"c_puct": 2.5, "leaf_batch_size": 4, "policy_temperature": 0.7, "margin_utility_lambda": 0.5, "merge_equivalent": true}, "status": "discard", "result": {"search_optimal": 0.86, "root_q_sign": 0.9833, "searched_positions": 600, "positions": 600, "sec_per_move": 0.116, "elapsed_seconds": 70, "peak_vram_mb": 0, "checkpoint": "/home/user/autoboxes/experiments/2026-10-08_14-42-boxes-3x3-loop/checkpoints/3x3-cpu/iter5.pt", "var": {"num_simulations": 100, "c_puct": 2.5, "leaf_batch_size": 4, "policy_temperature": 0.7, "margin_utility_lambda": 0.5, "margin_utility_k": 6.0, "solver_max_undrawn": 0, "solver_node_budget": 20000, "merge_equivalent": true}}, "seconds": 89}
{"description": "solver_max_undrawn=6 (exact leaves below the sampled band)", "var": {"c_puct": 2.5, "leaf_batch_size": 4, "policy_temperature": 0.7, "margin_utility_lambda": 0.5, "solver_max_undrawn": 6}, "status": "discard", "result": {"search_optimal": 0.865, "root_q_sign": 0.9803, "searched_positions": 557, "positions": 600, "sec_per_move": 0.0957, "elapsed_seconds": 57, "peak_vram_mb": 0, "checkpoint": "/home/user/autoboxes/experiments/2026-10-08_14-42-boxes-3x3-loop/checkpoints/3x3-cpu/iter5.pt", "var": {"num_simulations": 100, "c_puct": 2.5, "leaf_batch_size": 4, "policy_temperature": 0.7, "margin_utility_lambda": 0.5, "margin_utility_k": 6.0, "solver_max_undrawn": 6, "solver_node_budget": 20000, "merge_equivalent": false}}, "seconds": 76}
{"description": "solver_max_undrawn=8", "var": {"c_puct": 2.5, "leaf_batch_size": 4, "policy_temperature": 0.7, "margin_utility_lambda": 0.5, "solver_max_undrawn": 8}, "status": "discard", "result": {"search_optimal": 0.8667, "root_q_sign": 0.9762, "searched_positions": 463, "positions": 600, "sec_per_move": 0.0684, "elapsed_seconds": 41, "peak_vram_mb": 0, "checkpoint": "/home/user/autoboxes/experiments/2026-10-08_14-42-boxes-3x3-loop/checkpoints/3x3-cpu/iter5.pt", "var": {"num_simulations": 100, "c_puct": 2.5, "leaf_batch_size": 4, "policy_temperature": 0.7, "margin_utility_lambda": 0.5, "margin_utility_k": 6.0, "solver_max_undrawn": 8, "solver_node_budget": 20000, "merge_equivalent": false}}, "seconds": 59}
{"description": "solver_max_undrawn=10", "var": {"c_puct": 2.5, "leaf_batch_size": 4, "policy_temperature": 0.7, "margin_utility_lambda": 0.5, "solver_max_undrawn": 10}, "status": "discard", "result": {"search_optimal": 0.8717, "root_q_sign": 0.9825, "searched_positions": 342, "positions": 600, "sec_per_move": 0.0348, "elapsed_seconds": 21, "peak_vram_mb": 0, "checkpoint": "/home/user/autoboxes/experiments/2026-10-08_14-42-boxes-3x3-loop/checkpoints/3x3-cpu/iter5.pt", "var": {"num_simulations": 100, "c_puct": 2.5, "leaf_batch_size": 4, "policy_temperature": 0.7, "margin_utility_lambda": 0.5, "margin_utility_k": 6.0, "solver_max_undrawn": 10, "solver_node_budget": 20000, "merge_equivalent": false}}, "seconds": 40}
{"description": "sims=200 (double budget; cost in sec_per_move)", "var": {"c_puct": 2.5, "leaf_batch_size": 4, "policy_temperature": 0.7, "margin_utility_lambda": 0.5, "num_simulations": 200}, "status": "keep", "result": {"search_optimal": 0.8783, "root_q_sign": 0.995, "searched_positions": 600, "positions": 600, "sec_per_move": 0.2358, "elapsed_seconds": 142, "peak_vram_mb": 0, "checkpoint": "/home/user/autoboxes/experiments/2026-10-08_14-42-boxes-3x3-loop/checkpoints/3x3-cpu/iter5.pt", "var": {"num_simulations": 200, "c_puct": 2.5, "leaf_batch_size": 4, "policy_temperature": 0.7, "margin_utility_lambda": 0.5, "margin_utility_k": 6.0, "solver_max_undrawn": 0, "solver_node_budget": 20000, "merge_equivalent": false}}, "seconds": 159}
{"description": "sims=50 (half budget)", "var": {"c_puct": 2.5, "leaf_batch_size": 4, "policy_temperature": 0.7, "margin_utility_lambda": 0.5, "num_simulations": 50}, "status": "discard", "result": {"search_optimal": 0.8467, "root_q_sign": 0.9733, "searched_positions": 600, "positions": 600, "sec_per_move": 0.0841, "elapsed_seconds": 50, "peak_vram_mb": 0, "checkpoint": "/home/user/autoboxes/experiments/2026-10-08_14-42-boxes-3x3-loop/checkpoints/3x3-cpu/iter5.pt", "var": {"num_simulations": 50, "c_puct": 2.5, "leaf_batch_size": 4, "policy_temperature": 0.7, "margin_utility_lambda": 0.5, "margin_utility_k": 6.0, "solver_max_undrawn": 0, "solver_node_budget": 20000, "merge_equivalent": false}}, "seconds": 68}
{"description": "margin_utility_lambda=0.75 (k=6)", "var": {"c_puct": 2.5, "leaf_batch_size": 4, "policy_temperature": 0.7, "margin_utility_lambda": 0.75, "num_simulations": 200}, "status": "keep", "result": {"search_optimal": 0.8983, "root_q_sign": 0.9933, "searched_positions": 600, "positions": 600, "sec_per_move": 0.246, "elapsed_seconds": 148, "peak_vram_mb": 0, "checkpoint": "/home/user/autoboxes/experiments/2026-10-08_14-42-boxes-3x3-loop/checkpoints/3x3-cpu/iter5.pt", "var": {"num_simulations": 200, "c_puct": 2.5, "leaf_batch_size": 4, "policy_temperature": 0.7, "margin_utility_lambda": 0.75, "margin_utility_k": 6.0, "solver_max_undrawn": 0, "solver_node_budget": 20000, "merge_equivalent": false}}, "seconds": 166}
{"description": "margin_utility_lambda=1.0 (k=6)", "var": {"c_puct": 2.5, "leaf_batch_size": 4, "policy_temperature": 0.7, "margin_utility_lambda": 1.0, "num_simulations": 200}, "status": "keep", "result": {"search_optimal": 0.9167, "root_q_sign": 0.995, "searched_positions": 600, "positions": 600, "sec_per_move": 0.2435, "elapsed_seconds": 146, "peak_vram_mb": 0, "checkpoint": "/home/user/autoboxes/experiments/2026-10-08_14-42-boxes-3x3-loop/checkpoints/3x3-cpu/iter5.pt", "var": {"num_simulations": 200, "c_puct": 2.5, "leaf_batch_size": 4, "policy_temperature": 0.7, "margin_utility_lambda": 1.0, "margin_utility_k": 6.0, "solver_max_undrawn": 0, "solver_node_budget": 20000, "merge_equivalent": false}}, "seconds": 165}
{"description": "margin_utility_k=10 at the best lambda", "var": {"c_puct": 2.5, "leaf_batch_size": 4, "policy_temperature": 0.7, "margin_utility_lambda": 1.0, "num_simulations": 200, "margin_utility_k": 10.0}, "status": "discard", "result": {"search_optimal": 0.8983, "root_q_sign": 0.995, "searched_positions": 600, "positions": 600, "sec_per_move": 0.2451, "elapsed_seconds": 147, "peak_vram_mb": 0, "checkpoint": "/home/user/autoboxes/experiments/2026-10-08_14-42-boxes-3x3-loop/checkpoints/3x3-cpu/iter5.pt", "var": {"num_simulations": 200, "c_puct": 2.5, "leaf_batch_size": 4, "policy_temperature": 0.7, "margin_utility_lambda": 1.0, "margin_utility_k": 10.0, "solver_max_undrawn": 0, "solver_node_budget": 20000, "merge_equivalent": false}}, "seconds": 165}
{"description": "policy_temperature=0.5", "var": {"c_puct": 2.5, "leaf_batch_size": 4, "policy_temperature": 0.5, "margin_utility_lambda": 1.0, "num_simulations": 200}, "status": "discard", "result": {"search_optimal": 0.8933, "root_q_sign": 0.9867, "searched_positions": 600, "positions": 600, "sec_per_move": 0.2183, "elapsed_seconds": 131, "peak_vram_mb": 0, "checkpoint": "/home/user/autoboxes/experiments/2026-10-08_14-42-boxes-3x3-loop/checkpoints/3x3-cpu/iter5.pt", "var": {"num_simulations": 200, "c_puct": 2.5, "leaf_batch_size": 4, "policy_temperature": 0.5, "margin_utility_lambda": 1.0, "margin_utility_k": 6.0, "solver_max_undrawn": 0, "solver_node_budget": 20000, "merge_equivalent": false}}, "seconds": 149}
{"description": "solver_max_undrawn=10 on top of the best (tied round 1 at a third of the time)", "var": {"c_puct": 2.5, "leaf_batch_size": 4, "policy_temperature": 0.7, "margin_utility_lambda": 1.0, "num_simulations": 200, "solver_max_undrawn": 10}, "status": "discard", "result": {"search_optimal": 0.8817, "root_q_sign": 0.9912, "searched_positions": 342, "positions": 600, "sec_per_move": 0.0419, "elapsed_seconds": 25, "peak_vram_mb": 0, "checkpoint": "/home/user/autoboxes/experiments/2026-10-08_14-42-boxes-3x3-loop/checkpoints/3x3-cpu/iter5.pt", "var": {"num_simulations": 200, "c_puct": 2.5, "leaf_batch_size": 4, "policy_temperature": 0.7, "margin_utility_lambda": 1.0, "margin_utility_k": 6.0, "solver_max_undrawn": 10, "solver_node_budget": 20000, "merge_equivalent": false}}, "seconds": 43}
{"description": "leaf_batch_size=16 on top of the best (is leaf=4's gain worth 2x the time?)", "var": {"c_puct": 2.5, "leaf_batch_size": 16, "policy_temperature": 0.7, "margin_utility_lambda": 1.0, "num_simulations": 200}, "status": "discard", "result": {"search_optimal": 0.8783, "root_q_sign": 0.9917, "searched_positions": 600, "positions": 600, "sec_per_move": 0.1206, "elapsed_seconds": 72, "peak_vram_mb": 0, "checkpoint": "/home/user/autoboxes/experiments/2026-10-08_14-42-boxes-3x3-loop/checkpoints/3x3-cpu/iter5.pt", "var": {"num_simulations": 200, "c_puct": 2.5, "leaf_batch_size": 16, "policy_temperature": 0.7, "margin_utility_lambda": 1.0, "margin_utility_k": 6.0, "solver_max_undrawn": 0, "solver_node_budget": 20000, "merge_equivalent": false}}, "seconds": 91}
{"description": "c_puct=1.5 on top of the best (was c_puct=2.5's gain real?)", "var": {"c_puct": 1.5, "leaf_batch_size": 4, "policy_temperature": 0.7, "margin_utility_lambda": 1.0, "num_simulations": 200}, "status": "discard", "result": {"search_optimal": 0.9067, "root_q_sign": 0.995, "searched_positions": 600, "positions": 600, "sec_per_move": 0.2111, "elapsed_seconds": 127, "peak_vram_mb": 0, "checkpoint": "/home/user/autoboxes/experiments/2026-10-08_14-42-boxes-3x3-loop/checkpoints/3x3-cpu/iter5.pt", "var": {"num_simulations": 200, "c_puct": 1.5, "leaf_batch_size": 4, "policy_temperature": 0.7, "margin_utility_lambda": 1.0, "margin_utility_k": 6.0, "solver_max_undrawn": 0, "solver_node_budget": 20000, "merge_equivalent": false}}, "seconds": 144}
